source,signal_family,rows,first_date,last_date,coverage,access
International results,"scores, venue, competition",49477,1872-11-30,2026-06-27,1.0,open
Goalscorers,"players, scorer depth, penalties, timing",47697,1916-07-02,2026-06-19,0.3129437465865647,open
Historical FIFA ranking,external team strength,67894,1992-12-31,2024-09-19,0.9998379827377971,"open, scraped from FIFA"
Shootouts,penalty experience,678,1967-08-22,2026-06-06,0.013714424418957462,open
Fjelstul World Cup Database,"squads, age, positions, player experience",13843,1930-01-01,2022-12-18,0.7926749981940331,open
